{
  "$schema": "http://json-schema.org/draft-07/schema#",
  "$id": "https://github.com/IntersectMBO/UPLC-CAPE/submissions/TEMPLATE/metadata.schema.json",
  "title": "UPLC-CAPE Metadata Schema",
  "description": "Schema for benchmark submission metadata in the UPLC-CAPE framework",
  "type": "object",
  "properties": {
    "compiler": {
      "type": "object",
      "description": "Information about the compiler used",
      "properties": {
        "name": {
          "type": "string",
          "description": "Name of the compiler or toolchain",
          "examples": ["aiken", "plutus-tx", "plu-ts", "helios"]
        },
        "version": {
          "type": "string",
          "description": "Version of the compiler",
          "examples": ["1.0.8", "1.52.0.0", "0.7.1"]
        },
        "commit_hash": {
          "type": "string",
          "pattern": "^[a-f0-9]{40}$",
          "description": "Full Git commit hash (40 characters) of the compiler version"
        }
      },
      "required": ["name", "version"],
      "additionalProperties": false
    },
    "compilation_config": {
      "type": "object",
      "description": "Configuration used during compilation",
      "properties": {
        "optimization_level": {
          "type": "string",
          "description": "Optimization level used",
          "examples": ["none", "basic", "aggressive", "O0", "O1", "O2", "O3"]
        },
        "target": {
          "type": "string",
          "enum": ["uplc"],
          "description": "Compilation target (always 'uplc' for this framework)"
        },
        "flags": {
          "type": "array",
          "items": {
            "type": "string"
          },
          "description": "Additional compiler flags used",
          "examples": [
            ["--optimize"],
            ["-O2", "--inline-functions"],
            ["--no-dead-code-elimination"]
          ]
        },
        "min_protocol_version": {
          "type": "integer",
          "minimum": 1,
          "description": "Cardano protocol version this artifact requires to be accepted on-chain. Set it whenever the program uses a feature gated behind a hard fork: builtin casing and the batch-6 builtins (dropList, expModInteger, BLS12-381 multi-scalar multiplication, arrays, multi-asset values) require protocol version 11 (van Rossem). This is a property of the artifact and does not change when CAPE's evaluator moves. Omit for artifacts that use no gated feature. CAPE does not enforce it during measurement: the evaluator runs with testing machine parameters that enable every builtin regardless of protocol version, so a submission above the current mainnet protocol version still measures successfully. Use min_plutus_version to route such a submission to the preview evaluator.",
          "examples": [11]
        },
        "min_plutus_version": {
          "type": "string",
          "pattern": "^[0-9]+\\.[0-9]+\\.[0-9]+\\.[0-9]+$",
          "description": "Evaluator-routing knob, not a statement about on-chain requirements (use min_protocol_version for that). Set it only when the production evaluator cannot run the artifact at all, e.g. because its CEK machine predates a language construct the program uses. Compared against CAPE_CURRENT_PLUTUS_VERSION in scripts/lib/cape_versions.sh: a submission above that threshold is measured with the preview evaluator instead of the production one, and is skipped by 'cape submission verify --all'. Omit for submissions the production evaluator can execute, which is the normal case. Which track a submission is rendered in is decided separately, by its directory-name variant suffix.",
          "examples": ["1.63.0.0", "1.68.0.0"]
        }
      },
      "required": ["target"],
      "additionalProperties": false
    },
    "contributors": {
      "type": "array",
      "description": "Information about the contributors (all fields optional for privacy)",
      "items": {
        "type": "object",
        "properties": {
          "name": {
            "type": "string",
            "description": "Name or handle of the contributor"
          },
          "organization": {
            "type": "string",
            "description": "Organization or company affiliation"
          },
          "contact": {
            "type": "string",
            "description": "Contact information (email, GitHub handle, etc.)"
          }
        },
        "additionalProperties": false
      }
    },
    "submission": {
      "type": "object",
      "description": "Information about the submission",
      "properties": {
        "date": {
          "type": "string",
          "format": "date-time",
          "description": "ISO-8601 timestamp when the submission was created"
        },
        "source_available": {
          "type": "boolean",
          "description": "Whether source code is publicly available"
        },
        "source_repository": {
          "type": "string",
          "format": "uri",
          "description": "URL to source code repository (if source_available is true)"
        },
        "source_commit_hash": {
          "type": "string",
          "pattern": "^[a-f0-9]{40}$",
          "description": "Full Git commit hash (40 characters) of the source code used for this submission"
        },
        "implementation_notes": {
          "type": "string",
          "description": "Notes about the implementation approach, algorithms, or design decisions"
        }
      },
      "required": ["date", "source_available", "implementation_notes"],
      "additionalProperties": false
    }
  },
  "required": ["compiler", "compilation_config", "submission"],
  "additionalProperties": false
}
