{
  "compiler": {
    "name": "Plinth",
    "version": "1.60.0.0",
    "commit_hash": "d4c877e0b4b2ba38a90584c0e93368f72792ab51"
  },
  "compilation_config": {
    "optimization_level": "Plinth",
    "target": "uplc",
    "flags": ["Plinth", "BuiltinCasing"],
    "min_plutus_version": "1.60.0.0"
  },
  "contributors": [
    {
      "name": "Unisay",
      "organization": "UPLC-CAPE Project"
    }
  ],
  "submission": {
    "date": "2026-03-30T00:00:00Z",
    "source_available": true,
    "source_repository": "https://github.com/IntersectMBO/UPLC-CAPE",
    "implementation_notes": "Iterative Fibonacci compiled with Plinth 1.60.0.0 (plutus-core 1.60.0.0). This preview submission demonstrates the impact of newer compiler version on UPLC code generation. Requires plutus-core >= 1.60.0.0 (not yet on mainnet)."
  }
}
