{
  "compiler": {
    "name": "Scalus",
    "version": "1.3.0",
    "commit_hash": "31531c14d4e556fb38c984d702ee60dd82b6453f"
  },
  "compilation_config": {
    "target": "uplc",
    "flags": [],
    "min_protocol_version": 11
  },
  "contributors": [
    {
      "name": "Unisay",
      "organization": "Intersect MBO"
    }
  ],
  "submission": {
    "date": "2026-10-08T10:00:00Z",
    "source_available": true,
    "source_repository": "https://github.com/Unisay/scalus-cape-submissions",
    "source_commit_hash": "75678ebd8a1d627102095c4df1b72b774d0ccee8",
    "implementation_notes": "Scalus 1.3.0 HTLC spending validator (`@Compile object HTLCValidator`, `Data -> Unit`) deriving FromData/ToData for `HTLCDatum` and `HTLCRedeemer`. Claim reads the upper bound of `txInfoValidRange` (finite, strictly `< timeout`); refund reads the lower bound (finite, strictly `> timeout`), following the production-safe validity-range convention from IntersectMBO/UPLC-CAPE#170. Targets the van Rossem protocol version (Cardano protocol version 11), live on mainnet since 2026-07-18. Compiled once with `Options.release.copy(targetProtocolVersion = MajorProtocolVersion.vanRossemPV)` (Scala 3.3.8, `scalus-plugin` 1.3.0); there is no separate preview build any more. Compiler changes since 0.18.2 include recursion through self-application instead of the Z combinator, the static-argument transformation, the unified UPLC pipeline, and fee-aware CSE and inlining. The deprecated `findOwnInput` calls are kept, so the delta against 0.18.2 isolates the compiler change. The validator reads only lovelace, which Scalus does not lower to the CIP-153 Value builtins."
  }
}
