{
  "compiler": {
    "name": "Plinth",
    "version": "1.64.0.0",
    "commit_hash": "61b1eedf082050d89cde8db89d73aae65bc95a65"
  },
  "compilation_config": {
    "target": "uplc",
    "flags": []
  },
  "contributors": [
    {
      "name": "Unisay",
      "organization": "UPLC-CAPE Project"
    }
  ],
  "submission": {
    "date": "2026-07-08T07:23:46Z",
    "source_available": true,
    "source_repository": "https://github.com/Unisay/plinth-cape-submissions",
    "source_commit_hash": "1523b5333557c714ad48307e3ba11d3bf222a04e",
    "implementation_notes": "Two-party escrow validator written in `do`-notation on `Plinth.Validator`, a zero-cost early-termination monad, together with the zero-cost typed decoding DSL `Plinth.Decoder.Named`. `QualifiedDo` keeps `V.do` (decode-or-abort stages) beside `N.do` (Named walk regions); `IxDecoder` tracks the walk cursor in the type via a Peano-indexed fundep class (`FieldAt`), so each `ScriptContext`/datum field is decoded with a single `Constr` walk, and a value that is only compared is never structurally decoded (`Plinth.Encoded`). Retains the escrow security hardening: the escrow input is tied to the script's own payment credential, and the incomplete-withdrawal guard compares the payment credential only (ignoring the staking part). Re-optimised for CAPE metrics schema 2.0.0, whose aggregates cover only the happy-path (accept) measurements. total_fee 343225 to 111735 lovelace (-67.4%); promoted to the default artifact for this line, with the previous plain implementation retained as Plinth_1.64.0.0_Unisay_plain. Source: lib/TwoPartyEscrow/Monadic.hs (+ `lib/Plinth/Validator.hs`, `lib/Plinth/Decoder/Named.hs`, `lib/Plinth/Decoder/Named/ScriptContext.hs`, `lib/Plinth/Encoded.hs`) in plinth-cape-submissions @ 1523b5333557c714ad48307e3ba11d3bf222a04e (branch plinth-1.64)."
  }
}
