{
  "compiler": {
    "name": "Aiken",
    "version": "1.1.19",
    "commit_hash": "f49151c65dcf8f8483843509e3721c38d194e34e"
  },
  "compilation_config": {
    "target": "uplc",
    "flags": []
  },
  "contributors": [
    {
      "name": "KtorZ",
      "organization": "Cardano Foundation",
      "contact": "@KtorZ"
    }
  ],
  "submission": {
    "date": "2025-10-18T12:14:19.225Z",
    "source_available": true,
    "implementation_notes": "Using pre-packed values with fast dynamic selection. Higher size, but constant (and small) evaluation cost.",
    "source_repository": "https://github.com/Unisay/aiken-cape-submissions",
    "source_commit_hash": "0a4a8789b18b1a075cdcf76411190a9d2083b988"
  }
}
