{
  "compiler": {
    "name": "Scalus",
    "version": "0.18.2",
    "commit_hash": "a17580cd7a0fbb55083797ca16ae63ee924afe10"
  },
  "compilation_config": {
    "target": "uplc",
    "flags": [],
    "min_protocol_version": 11
  },
  "contributors": [
    {
      "name": "Unisay",
      "organization": "Intersect MBO"
    }
  ],
  "submission": {
    "date": "2026-07-07T17:13:55Z",
    "source_available": true,
    "source_repository": "https://github.com/Unisay/scalus-cape-submissions",
    "source_commit_hash": "6aa01a8ab6dbf0501efdea5bca4e3b832a1307b5",
    "implementation_notes": "Scalus 0.18.2 Linear vesting spending validator (`@Compile object LinearVestingValidator`, `Data -> Unit`) releasing a native asset to a beneficiary on an installment schedule, with all parameters carried in the datum. Redeemer is a nullary constructor (`Constr 0 []` = PartialUnlock, `Constr 1 []` = FullUnlock; a raw-integer redeemer is rejected). Targets the van Rossem protocol version (Cardano protocol version 11), live on mainnet since 2026-07-18. Same source as the pre-fork Scalus_0.18.2_Unisay submission it replaces, recompiled with `Options.release.copy(targetProtocolVersion = MajorProtocolVersion.vanRossemPV)`, which enables `case-on-builtins` and batch-6 builtins (e.g. `dropList`). Measured on `PlutusVM.makePlutusV3VM(MajorProtocolVersion.vanRossemPV)`."
  }
}
