{
  "compiler": {
    "name": "Plutarch",
    "version": "1.11.0",
    "commit_hash": "427e49b0cbfd2ff97cdc91522a09e06edd7a7fa6"
  },
  "compilation_config": {
    "optimization_level": "size",
    "target": "uplc",
    "flags": []
  },
  "contributors": [
    {
      "name": "SeungheonOh"
    }
  ],
  "submission": {
    "date": "2025-10-17T00:00:00Z",
    "source_available": true,
    "source_repository": "https://github.com/Unisay/plutarch-cape-submissions",
    "source_commit_hash": "994cc9eff4a63e62509ba6b25cedafcbe4680824",
    "implementation_notes": "Size-optimized factorial implementation using custom pfix' (inlines recursion point) and pif'' (avoids hoisting IfThenElse builtin) combinators to minimize script size"
  }
}
