{
  "compiler": {
    "name": "Scalus",
    "version": "1.3.0",
    "commit_hash": "31531c14d4e556fb38c984d702ee60dd82b6453f"
  },
  "compilation_config": {
    "optimization_level": "Scalus",
    "target": "uplc",
    "flags": ["Scalus"],
    "min_protocol_version": 11
  },
  "contributors": [
    {
      "name": "Unisay",
      "organization": "Intersect MBO"
    }
  ],
  "submission": {
    "date": "2026-10-08T10:00:00Z",
    "source_available": true,
    "source_repository": "https://github.com/Unisay/scalus-cape-submissions",
    "source_commit_hash": "7bc2e45cae3c75960609534626c8779d069f1384",
    "implementation_notes": "Scalus 1.3.0 Fibonacci program computing `fib(n)` by naive (exponential) recursion (`Data -> Unit`). Targets the van Rossem protocol version (Cardano protocol version 11), live on mainnet since 2026-07-18. Compiled once with `Options.release.copy(targetProtocolVersion = MajorProtocolVersion.vanRossemPV)` (Scala 3.3.8, `scalus-plugin` 1.3.0); there is no separate preview build any more. Compiler changes since 0.18.2 include recursion through self-application instead of the Z combinator, the static-argument transformation, the unified UPLC pipeline, and fee-aware CSE and inlining."
  }
}
